"No results found","Nici un rezultat."
"Write","Tasteaza"
"or more characters for results.","sau mai multe caractere pentru rezultate."
"Begin typing for results.","Tastează pentru rezultate."
"Please complete this field and select one of the values ​​below.","Vă rugăm completați câmpul si selectați una din valorile de mai jos."
"Show Autocomplete after Country field","Afișeaza campul autocomplete dupa campul 'Tara'"
"No matches","Pentru afișarea rezultatelor vă rugăm completați minim 2 caractere din oraș/județ sau cod poștal si selectați una din valorile de mai jos."
"No matches easybox","Pentru afișarea rezultatelor vă rugăm completați minim 2 caractere și selectați una din valorile de mai jos." 